{
  "schemaVersion": 2,
  "reportDate": "2026-08-03",
  "generatedAt": "2026-08-03T11:00:00Z",
  "status": "partial",
  "countries": [
    {
      "id": "usa",
      "label": "USA",
      "categories": [
        {
          "id": "politics_society",
          "status": "published",
          "headlineDe": "Millionen Amerikaner verlieren Lebensmittelhilfe durch SNAP-Kürzungen",
          "summaryDe": [
            "Über vier Millionen Menschen haben seit Juli 2025 aufgehört, SNAP-Lebensmittelhilfe zu erhalten, was auf weitreichende Programmkürzungen und -änderungen zurückzuführen ist.",
            "Die Beteiligung am staatlichen Ernährungshilfeprogramm ist seither kontinuierlich gesunken, wobei historisch einmalige Einschnitte als Hauptursache gelten.",
            "Dies betrifft vor allem einkommensschwache Haushalte, Familien mit Kindern sowie ältere Menschen, die auf die Unterstützung angewiesen sind.",
            "Sozialpolitische Organisationen warnen vor einer wachsenden Versorgungslücke und steigender Ernährungsunsicherheit in betroffenen Bundesstaaten.",
            "Die Entwicklung gilt als Teil umfassenderer Sparmaßnahmen der aktuellen Bundesregierung im Sozialleistungsbereich."
          ],
          "additionalImportant": "Das Justizministerium geht zunehmend mit Bundesverschwörungsvorwürfen gegen Protestierende vor, die sich gegen ICE-Abschiebungen stellen, was Rechtsexperten als unverhältnismäßig kritisieren.",
          "germanyRelevance": {
            "score": 1,
            "reasonDe": "Indirekt relevant als Beobachtungsfall für Sozialstaatsabbau unter populistischen Regierungen, ohne direkte Folgen für Deutschland."
          },
          "overallSignificance": {
            "score": 2,
            "reasonDe": "Die Streichung von Lebensmittelhilfe für Millionen Menschen stellt eine größere sozialpolitische Veränderung in der weltgrößten Volkswirtschaft dar."
          },
          "sourceBasis": "single",
          "limitations": [
            "single_source"
          ],
          "sources": [
            {
              "name": "Vijesti",
              "type": "unabhängige Tagesnachrichten",
              "titleOriginal": "Izabrani izvođači za gradnju Bulevara Velje brdo i izradu Glavnog proekta bloka a1",
              "url": "https://www.vijesti.me/vijesti/ekonomija/820557/izabrani-izvodjaci-za-gradnju-bulevara-velje-brdo-i-izradu-glavnog-proekta-bloka-a1",
              "publishedAt": "2026-08-03T09:59:00Z"
            }
          ]
        },
        {
          "id": "economy_technology",
          "status": "published",
          "headlineDe": "USA entkoppeln Rüstungsindustrie von chinesischen Seltenen Erden",
          "summaryDe": [
            "Eine neue Exekutivorder verpflichtet große US-Rüstungsunternehmen, ihre Lieferketten auf chinesische Mineralien zu überprüfen und diese schrittweise zu ersetzen.",
            "Ziel ist die Verringerung strategischer Abhängigkeiten von China im Bereich kritischer Rohstoffe, die für moderne Waffensysteme unverzichtbar sind.",
            "Die Maßnahme wird von Befürwortern als sicherheitspolitisch überfällig begrüßt, während Kritiker auf erhebliche Kosten und Lieferengpässe für die Industrie hinweisen.",
            "China kontrolliert einen Großteil der weltweiten Verarbeitung Seltener Erden und kann diese Dominanz als geopolitisches Druckmittel einsetzen.",
            "Die Anordnung reiht sich in eine breitere US-Strategie ein, wirtschaftliche Abhängigkeiten von China in sicherheitsrelevanten Bereichen systematisch abzubauen."
          ],
          "additionalImportant": null,
          "germanyRelevance": {
            "score": 2,
            "reasonDe": "Die Umstrukturierung globaler Lieferketten für Seltene Erden betrifft auch die deutsche Rüstungs- und Technologieindustrie direkt."
          },
          "overallSignificance": {
            "score": 2,
            "reasonDe": "Die staatlich angeordnete Entkopplung eines gesamten Industriesektors von chinesischen Rohstoffen ist eine größere geopolitisch-wirtschaftliche Weichenstellung."
          },
          "sourceBasis": "single",
          "limitations": [
            "single_source"
          ],
          "sources": [
            {
              "name": "South China Morning Post",
              "type": "Hongkong-/Regionalperspektive",
              "titleOriginal": "Pain or gain? US moves to decouple its defence industry from China's rare earths",
              "url": "https://www.scmp.com/news/china/diplomacy/article/3362641/pain-or-gain-us-moves-decouple-its-defence-industry-chinas-rare-earths",
              "publishedAt": "2026-08-01T14:00:11Z"
            }
          ]
        },
        {
          "id": "foreign_security",
          "status": "published",
          "headlineDe": "Trump kündigt Angriffe auf Iran an und stoppt sie wieder – Volatilität prägt US-Iranpolitik",
          "summaryDe": [
            "Trump kündigt immer wieder Stopps von Angriffen auf Iran an, während militärische Operationen faktisch weiterlaufen, was zu einer außenpolitisch unberechenbaren Situation führt.",
            "Abrupte Politikwechsel untergraben angekündigte Waffenstillstände innerhalb von Stunden oder Tagen und erschweren diplomatische Initiativen erheblich.",
            "US-Botschaften haben Reisewarnungen für Amerikaner im Ausland herausgegeben und verweisen auf erhöhte Risiken durch mögliche neue US-Militäraktionen gegen Iran.",
            "Gleichzeitig äußert Israel ernste Bedenken gegenüber dem von Trump angekündigten Hamas-Entwaffnungsabkommen, da der israelische Geheimdienst Hamas als weiterhin auf militärischen Wiederaufbau ausgerichtet einschätzt.",
            "Die Kombination aus Irandynamik und Gaza-Abkommen zeigt eine US-Nahostpolitik, die durch widersprüchliche Signale und innenpolitische Druckverhältnisse geprägt ist."
          ],
          "additionalImportant": null,
          "germanyRelevance": {
            "score": 2,
            "reasonDe": "Eine Eskalation im Nahen Osten hätte unmittelbare Folgen für europäische Energiemärkte, Flüchtlingsbewegungen und NATO-Bündnisabstimmungen."
          },
          "overallSignificance": {
            "score": 3,
            "reasonDe": "Unkontrollierte militärische Volatilität einer Supermacht gegenüber einem regionalen Akteur mit Nuklearprogramm ist von außerordentlicher internationaler Bedeutung."
          },
          "sourceBasis": "single",
          "limitations": [
            "single_source",
            "source_disagreement"
          ],
          "sources": [
            {
              "name": "Vijesti",
              "type": "unabhängige Tagesnachrichten",
              "titleOriginal": "Mučnost crnobjelizacije",
              "url": "https://www.vijesti.me/kolumne/820473/mucnost-crnobjelizacije",
              "publishedAt": "2026-08-03T08:45:00Z"
            }
          ]
        }
      ]
    },
    {
      "id": "china",
      "label": "China",
      "categories": [
        {
          "id": "politics_society",
          "status": "published",
          "headlineDe": "Tödliche Überschwemmungen in Gansu: 25 Tote, Alarmstufe in weiten Teilen Chinas",
          "summaryDe": [
            "Sturzfluten im Kreis Weiyuan der nordwestlichen Provinz Gansu forderten am 26. Juli mindestens 25 Todesopfer und 23 Verletzte.",
            "Die Opferzahl stieg gegenüber ersten Berichten, da Rettungskräfte weiterhin in abgelegene Gebiete vordringen.",
            "Starkregen hält in großen Teilen des Landes an, zahlreiche Regionen befinden sich weiterhin in erhöhter Alarmbereitschaft.",
            "Die Überschwemmungen reihen sich in eine Serie schwerer Extremwetterereignisse ein, die China im Sommer 2026 betreffen.",
            "Staatliche Medien berichten intensiv über Katastrophenschutzmaßnahmen, während Experten auf die Zunahme solcher Ereignisse durch den Klimawandel hinweisen."
          ],
          "additionalImportant": "Im Stahlwerk Baotou Steel in der Inneren Mongolei wurden nach einer Explosion mit 10 Toten und 84 Verletzten sieben Personen zur Verhaftung vorgeschlagen; Ermittlungen ergaben schwere Sicherheitsmängel durch Korrosionsschäden an einem Druckbehälter.",
          "germanyRelevance": {
            "score": 0,
            "reasonDe": "Naturkatastrophen in China haben keinen direkten Bezug zu Deutschland."
          },
          "overallSignificance": {
            "score": 1,
            "reasonDe": "Regionale Überschwemmungen mit Todesopfern sind für China im Sommer ein wiederkehrendes Ereignis von begrenzter internationaler Tragweite."
          },
          "sourceBasis": "single",
          "limitations": [
            "single_source"
          ],
          "sources": [
            {
              "name": "South China Morning Post",
              "type": "Hongkong-/Regionalperspektive",
              "titleOriginal": "China floods: large parts of country remain on alert as Gansu province death toll rises",
              "url": "https://www.scmp.com/news/china/article/3362695/china-floods-large-parts-country-remain-alert-gansu-province-death-toll-rises",
              "publishedAt": "2026-08-02T06:58:42Z"
            }
          ]
        },
        {
          "id": "economy_technology",
          "status": "published",
          "headlineDe": "Changchun-Parteichef warnt öffentlich vor „beispiellosen Schwierigkeiten",
          "summaryDe": [
            "Der Parteichef der nordostchinesischen Stadt Changchun, Zhang Enhui, brach mit politischen Konventionen, indem er öffentlich vor ‚beispiellosen Schwierigkeiten und Herausforderungen' für die Stadtwirtschaft warnte.",
            "Die Äußerungen wurden anschließend von offiziellen Websites entfernt, was auf Unbehagen höherer Ebenen über die offene Krisenrhetorik hindeutet.",